{
  "meta": {
    "project_id": "PRJ-2026-001",
    "title": "크몽 문의 자동 응대 시스템",
    "version": "1.0.0",
    "created_at": "2026-04-09T22:01:29.335929+09:00",
    "status": "draft",
    "author": "PlanForge Agent",
    "client": "A사 마케팅팀",
    "tags": [
      "자동화",
      "CS",
      "크몽"
    ]
  },
  "overview": {
    "category": "고객관리/CS",
    "one_liner": "크몽 문의를 자동으로 감지, 분류하여 맞춤 응답하는 시스템",
    "background": "A사 마케팅팀은 크몽에서 디자인 서비스를 판매하며 하루 평균 30건의 문의를 받는다.",
    "problem": "수동 응대로 평균 응답 시간이 4시간을 초과하고, 반복 질문 응대 비효율 및 응답 지연으로 인한 전환율 저하 문제를 겪고 있다.",
    "solution": "크몽의 새 문의를 5분 주기로 자동 감지하고, AI를 통해 문의 유형(가격, 기간 등)을 분류한다. 분류된 유형에 따라 자동 응답을 발송하거나, 복잡한 문의는 담당자에게 카카오톡으로 즉시 알림을 보내 응대 프로세스를 자동화하고 효율을 극대화한다."
  },
  "target_users": [
    {
      "role": "크몽 판매자 (A사 마케팅팀)",
      "description": "디자인 서비스 판매 및 고객 문의 응대를 담당하며, 응대 시간 단축과 전환율 상승을 목표로 한다.",
      "goals": [
        "평균 응답 시간을 5분 이내로 단축",
        "반복적인 문의 응대 업무 제거",
        "문의 전환율 15% 이상 달성"
      ],
      "pain_points": [
        "반복적인 질문(가격, 기간 등)에 수동으로 답변",
        "응답 지연으로 인한 잠재 고객 이탈",
        "주요 업무 중 문의를 놓치는 경우 발생"
      ]
    }
  ],
  "scenarios": [
    {
      "id": "SC-001",
      "title": "단순 문의(가격) 자동 응대",
      "actor": "잠재 고객",
      "precondition": "고객이 크몽 메시지를 통해 판매자에게 문의한다.",
      "steps": [
        {
          "order": 1,
          "action": "시스템이 5분 내 크몽의 새 메시지를 감지한다.",
          "expected_result": "새 메시지의 내용과 발신자 정보가 수집된다."
        },
        {
          "order": 2,
          "action": "AI가 메시지 내용을 '가격 문의' 유형으로 분류한다.",
          "expected_result": "문의 유형이 'price_inquiry'로 확정된다."
        },
        {
          "order": 3,
          "action": "시스템이 미리 정의된 가격 정보 템플릿을 기반으로 자동 응답을 생성하고 발송한다.",
          "expected_result": "고객은 5분 이내에 가격 관련 답변을 받는다."
        },
        {
          "order": 4,
          "action": "응대 내역(문의유형, 응답내용)이 구글 시트에 기록된다.",
          "expected_result": "구글 시트에 새로운 로그 행이 추가된다."
        }
      ],
      "postcondition": "문의 접수 후 5분 이내에 자동 응대가 완료되고 로그가 기록된다."
    },
    {
      "id": "SC-002",
      "title": "복합 문의 담당자 알림",
      "actor": "잠재 고객",
      "precondition": "고객이 크몽 메시지를 통해 복합적인 맞춤 제작 문의를 한다.",
      "steps": [
        {
          "order": 1,
          "action": "시스템이 5분 내 크몽의 새 메시지를 감지한다.",
          "expected_result": "새 메시지의 내용과 발신자 정보가 수집된다."
        },
        {
          "order": 2,
          "action": "AI가 메시지 내용을 '커스텀 문의' 유형으로 분류한다.",
          "expected_result": "문의 유형이 'custom_inquiry'로 확정된다."
        },
        {
          "order": 3,
          "action": "시스템이 담당자에게 카카오톡 알림톡으로 문의 내용과 링크를 발송한다.",
          "expected_result": "담당자는 1분 이내에 카카오톡으로 알림을 받는다."
        },
        {
          "order": 4,
          "action": "알림 내역이 구글 시트에 기록된다.",
          "expected_result": "구글 시트에 새로운 로그 행이 추가된다."
        }
      ],
      "postcondition": "담당자가 문의 내용을 인지하고 직접 응대를 시작할 수 있다."
    }
  ],
  "features": [
    {
      "id": "F-001",
      "title": "크몽 메시지 자동 수집",
      "description": "5분 주기로 크몽 메시지함을 스캔하여 읽지 않은 새 메시지를 수집한다.",
      "priority": "critical",
      "acceptance_criteria": [
        "5분 이내에 새 메시지를 감지해야 한다.",
        "이미 처리한 메시지를 중복으로 수집하지 않아야 한다."
      ],
      "linked_scenario_ids": [
        "SC-001",
        "SC-002"
      ],
      "linked_spec_id": "SPEC-001"
    },
    {
      "id": "F-002",
      "title": "AI 기반 문의 유형 분류",
      "description": "수집된 메시지 내용을 분석하여 '가격', '작업기간', '수정횟수', '커스텀' 등 5개 이상의 유형으로 분류한다.",
      "priority": "critical",
      "acceptance_criteria": [
        "분류 정확도가 90% 이상이어야 한다.",
        "분류 불가 시 '기타' 유형으로 처리할 수 있어야 한다."
      ],
      "linked_scenario_ids": [
        "SC-001",
        "SC-002"
      ],
      "linked_spec_id": "SPEC-002"
    },
    {
      "id": "F-003",
      "title": "맞춤 응답 자동 생성 및 발송",
      "description": "분류된 유형에 따라 미리 정의된 템플릿을 사용하여 응답 메시지를 생성하고 크몽을 통해 발송한다.",
      "priority": "high",
      "acceptance_criteria": [
        "응답 생성 및 발송까지 1분 이내에 완료되어야 한다."
      ],
      "linked_scenario_ids": [
        "SC-001"
      ],
      "linked_spec_id": "SPEC-003"
    },
    {
      "id": "F-004",
      "title": "담당자 알림 (카카오톡 알림톡)",
      "description": "'커스텀' 또는 '기타' 유형으로 분류된 문의는 담당자에게 카카오톡 알림톡으로 즉시 알린다.",
      "priority": "high",
      "acceptance_criteria": [
        "분류 후 1분 이내에 알림이 발송되어야 한다.",
        "알림 메시지에는 발신자, 문의 내용 요약, 크몽 메시지 링크가 포함되어야 한다."
      ],
      "linked_scenario_ids": [
        "SC-002"
      ],
      "linked_spec_id": "SPEC-004"
    },
    {
      "id": "F-005",
      "title": "응대 내역 로그 기록",
      "description": "모든 수신 문의와 시스템의 처리(자동응답, 알림) 내역을 구글 시트에 자동으로 기록한다.",
      "priority": "medium",
      "acceptance_criteria": [
        "수신시간, 발신자, 문의유형, 처리방식, 처리시간이 정확히 기록되어야 한다."
      ],
      "linked_scenario_ids": [
        "SC-001",
        "SC-002"
      ],
      "linked_spec_id": "SPEC-005"
    }
  ],
  "automation_context": {
    "target_systems": [
      {
        "name": "크몽",
        "type": "web_app",
        "access_method": "browser_automation",
        "auth_required": true,
        "notes": "공식 API 없음. Playwright 사용 필수. 세션 갱신 로직 필요."
      },
      {
        "name": "Google Sheets",
        "type": "spreadsheet",
        "access_method": "api",
        "auth_required": true,
        "notes": "TODO: 클라이언트로부터 공유받을 스프레드시트 ID 및 API 권한 필요"
      },
      {
        "name": "카카오톡 알림톡",
        "type": "messenger",
        "access_method": "api",
        "auth_required": true,
        "notes": "TODO: 클라이언트의 알림톡 채널 및 API 키 확인 필요"
      }
    ],
    "triggers": [
      {
        "id": "TRG-001",
        "event": "스케줄 기반 체크",
        "source": "시스템 크론",
        "condition": "매 5분"
      }
    ],
    "actions": [
      {
        "id": "ACT-001",
        "order": 1,
        "action_type": "scrape",
        "description": "크몽 메시지함 스크래핑",
        "target_system": "크몽",
        "input_fields": [
          {
            "name": "session_cookie",
            "type": "string",
            "required": true,
            "source": "auth_manager"
          }
        ],
        "output_fields": [
          {
            "name": "new_messages",
            "type": "array"
          }
        ],
        "trigger_id": "TRG-001",
        "depends_on": []
      },
      {
        "id": "ACT-002",
        "order": 2,
        "action_type": "decision",
        "description": "AI 문의 유형 분류",
        "target_system": "LLM API",
        "input_fields": [
          {
            "name": "message_content",
            "type": "string",
            "required": true,
            "source": "ACT-001.output.new_messages"
          }
        ],
        "output_fields": [
          {
            "name": "inquiry_type",
            "type": "string"
          }
        ],
        "depends_on": [
          "ACT-001"
        ]
      },
      {
        "id": "ACT-003",
        "order": 3,
        "action_type": "generate_content",
        "description": "맞춤 응답 생성",
        "target_system": "LLM API",
        "input_fields": [
          {
            "name": "inquiry_type",
            "type": "string",
            "required": true,
            "source": "ACT-002.output"
          }
        ],
        "output_fields": [
          {
            "name": "response_message",
            "type": "string"
          }
        ],
        "depends_on": [
          "ACT-002"
        ]
      },
      {
        "id": "ACT-004",
        "order": 4,
        "action_type": "data_write",
        "description": "크몽 자동 응답 발송",
        "target_system": "크몽",
        "input_fields": [
          {
            "name": "target_message_id",
            "type": "string",
            "required": true,
            "source": "ACT-001.output.new_messages"
          },
          {
            "name": "response_message",
            "type": "string",
            "required": true,
            "source": "ACT-003.output"
          }
        ],
        "output_fields": [
          {
            "name": "sent_status",
            "type": "boolean"
          }
        ],
        "depends_on": [
          "ACT-003"
        ]
      },
      {
        "id": "ACT-005",
        "order": 4,
        "action_type": "notify",
        "description": "담당자 카카오톡 알림",
        "target_system": "카카오톡 알림톡",
        "input_fields": [
          {
            "name": "message_content",
            "type": "string",
            "required": true,
            "source": "ACT-001.output.new_messages"
          },
          {
            "name": "sender_name",
            "type": "string",
            "required": true,
            "source": "ACT-001.output.new_messages"
          }
        ],
        "output_fields": [
          {
            "name": "notification_sent",
            "type": "boolean"
          }
        ],
        "depends_on": [
          "ACT-002"
        ]
      },
      {
        "id": "ACT-006",
        "order": 5,
        "action_type": "data_write",
        "description": "구글 시트 로그 기록",
        "target_system": "Google Sheets",
        "input_fields": [
          {
            "name": "timestamp",
            "type": "date",
            "required": true,
            "source": "system"
          },
          {
            "name": "inquiry_type",
            "type": "string",
            "required": true,
            "source": "ACT-002.output"
          },
          {
            "name": "action_taken",
            "type": "string",
            "required": true,
            "source": "conditional(ACT-004 or ACT-005)"
          }
        ],
        "output_fields": [],
        "depends_on": [
          "ACT-004",
          "ACT-005"
        ]
      }
    ],
    "error_handling": [
      {
        "error_type": "auth_failure",
        "target_action_id": "ACT-001",
        "handling": "retry",
        "retry_count": 2,
        "fallback_action": "세션 갱신 시도 후 실패 시 담당자에게 알림"
      },
      {
        "error_type": "api_error",
        "target_action_id": "ACT-002",
        "handling": "fallback",
        "retry_count": 0,
        "fallback_action": "분류 실패로 간주하고 담당자에게 알림 (ACT-005 실행)"
      }
    ],
    "data_flow": [